Code,Description,Default_Translation (en-en),Target_Translation (lv-lv),Has_Translation
I18N_EXPORT_EXCEL,I18NCode user for export as excel on dropdown,Export as Excel,Eksportēt kā Excel,Yes
I18N_EXPORT_GENERAL_REPORT,I18NCode for Export General Report in Notable Networkers Page,Export General Report,Eksporta vispārīgais ziņojums,Yes
I18N_EXPORT_PDF,I18NCode user for export as pdf on dropdown,Export as PDF,Eksportēt kā PDF,Yes
I18N_EXPORT_REPORT,I18NCode for label on export dropdown,Export Report,Eksporta ziņojums,Yes
I18N_EXPORT_TRANSLATIONS,I18NCode for Export Translations,Export Translations,Eksportēt tulkojumus,Yes
I18N_EXTERNAL,I18NCode for External,External,Ārējais,Yes
I18N_FAILED_TO_CREATE_ACCOUNT,I18NCode for Failed To Create Account,Failed to create account,Neizdevās izveidot kontu,Yes
I18N_FAILED_TO_RESET_PASSWORD,I18NCode for Failed to reset Password,Failed to reset Password,Neizdevās atiestatīt paroli,Yes
I18N_FAILED_TO_SEND_EMAIL,I18NCode for Failed To Send Email,Failed to send email,Neizdevās nosūtīt e-pastu,Yes
I18N_FALLING_MEMBERS,I18NCode for Falling members,Falling,Krīt,Yes
I18N_FAQ_1,I18NCode for Faq 1,"Chapter President shows as ""N/A"", why?","Nodaļas priekšsēdētājs parāda kā ""N/A"", kāpēc?",Yes
I18N_FAQ_1_ANSWER,I18NCode for Faq 1 Answer,"When Chapter Leadership name shows as ""N/A"" it means that his/her email was changed. Need to update his/her email on reporting2you","Ja nodaļas vadītāja vārds tiek rādīts kā ""N/A"", tas nozīmē, ka viņa/viņas e-pasts ir mainīts.",Yes
I18N_FAQ_2,I18NCode for Faq 2,Where can I find Chapter Reports?,Kur es varu atrast nodaļas pārskatus?,Yes
I18N_FAQ_2_ANSWER,I18NCode for Faq 2 Answer,"Go to Reports Menu click the plus sign (""+"") to open Chapters tree and then click on the chapters name, you will get the list of reports from current month to that chapter.<br/> If you want to get a previous report you should click the ""History"" item in the Chapters list and you will be able to get reports from the past 12 month.","Atveriet izvēlni Pārskati noklikšķiniet uz pluszīmes (""+""), lai atvērtu nodaļu koku, un pēc tam noklikšķiniet uz nodaļu nosaukuma, jūs iegūsit pārskatu sarakstu no pašreizējā mēneša līdz šai nodaļai.<br/> Ja vēlaties iegūt iepriekšējo pārskatu, nodaļu sarakstā noklikšķiniet uz vienuma ""Vēsture"", un jūs varēsit iegūt pārskatus par pēdējiem 12 mēnešiem.",Yes
I18N_FAQS,I18NCode for Faqs,Faqs,Bieži uzdotie jautājumi,Yes
I18N_FAST__EFFICIENT_AND_PRODUCTIVE,"I18NCode for Fast, Efficient and Productive
","Fast, Efficient and Productive","Ātri, efektīvi un produktīvi",Yes
I18N_FEBRUARY,I18NCode for February,February,februāris,Yes
I18N_FEE,I18NCode for Fee,Fee,Maksa,Yes
I18N_FILES,I18NCode for Files,Files,Faili,Yes
I18N_FILL,I18NCode for Fill,Fill,Aizpildiet,Yes
I18N_FILL_CHAPTERS,I18NCode for Fill Chapters,Fill Chapters,Aizpildiet nodaļas,Yes
I18N_FILTER,I18NCode for Filter,Filter,Filtrs,Yes
I18N_FILTER_OPTIONS,I18NCode for Filter Options,Filter options,Filtra opcijas,Yes
I18N_FIRST,I18NCode for First,First,Pirmkārt,Yes
I18N_FIRST_MEMBERS_IN_TRAFFIC_LIGHTS,I18NCode for First Members in Traffic Lights,First Members in Traffic Lights,Pirmie dalībnieki luksoforos,Yes
I18N_FIRST_NAME,I18NCode for First Name label,First Name,Vārds,Yes
I18N_FIRST_YEAR_RETAIN,I18NCode for First Year Retain,First Year,Pirmais gads,Yes
I18N_FIRST_YEAR_RETENTION,I18NCode for First Year Retention,First Year Retention,Pirmā gada saglabāšana,Yes
I18N_FLAG,I18NCode for the flag,Flag,Karogs,Yes
I18N_FOLLOW_UP,I18NCode for Follow Up Page in Tasks Menu,Follow Up,Sekojiet līdzi,Yes
I18N_FOR,"i18NCode for ""For""",for,priekš,Yes
I18N_FOR_SUBSTITUTION,"I18NCode for ""For Substitution""",For Substitution,Aizstāšanai,Yes
I18N_FORGOT_PASSWORD_,I18NCode for Forgot Password?,Forgot Password?,Aizmirsāt paroli?,Yes
I18N_FORMATION,I18NCode for Formation,Formation,Veidošanās,Yes
I18N_FORMATIONS,I18NCode for Formations,Formations,Veidojumi,Yes
I18N_FORMATS,I18NCode for Formats,Formats,Formāti,Yes
I18N_FRANCHISE,I18NCode for Franchise,Franchise,Franšīze,Yes
I18N_FROM,I18Code for From,From,No,Yes
I18N_FUNCTIONAL_COOKIES,"I18NCode for Functional cookies
",Functional cookies,Funkcionālās sīkdatnes,Yes
I18N_FUTURE_RENEWALS,I18NCode for Future Renewals,Future Renewals,Nākotnes atjaunošana,Yes
I18N_GAME_RESULT,I18NCode for Game Result,Game result for,Spēles rezultāts priekš,Yes
I18N_GAMES,I18NCode for Games,Games,Spēles,Yes
I18N_GENERATE,I18NCode for Generate,Generate,Ģenerēt,Yes
I18N_GENERATE_TEAMS,I18NCode for Generate Teams,Automatically generate teams,Automātiski ģenerējiet komandas,Yes
I18N_GET_DEFAULT,I18NCode for Get Default,Get Default,Saņemt noklusējumu,Yes
I18N_GIVE_NO_REFERRALS_ON_LAST,I18NCode for Give No Referrals On Last,Give No Referrals On Last,Pēdējā laikā nedodiet ieteikumus,Yes
I18N_GIVEN_BUSINESS,I18NCode for Given Business Chart,Given Business,Dots bizness,Yes
I18N_GIVEN_REFERRALS,I18NCode for Given Referrals Chart,Given Referrals,Dotie ieteikumi,Yes
I18N_GOAL,I18NCode for Goal,Goal,Mērķis,Yes
I18N_GOAL_ABREV,I18NCode for Goal,Goal,Mērķis,Yes
I18N_GOAL_ABSENTISM_TOOLTIP,I18NCode for Goal Absentism Tooltip,Expected absence at the end of the period (ex: 2.5),"Paredzamā prombūtne perioda beigās (piem.: 2,5)",Yes
I18N_GOAL_CEU_TOOLTIP,I18Ncode for Goal Ceu Tooltip,Chapter Education Units/member/week,Nodaļa Izglītība Vienības/biedrs/nedēļā,Yes
I18N_GOAL_CONVERSIONTOOLTIP,I18NCode for Goal ConversionTooltip,Average Conversion (ex: 17.5),"Vidējais reklāmguvums (piemēram, 17,5)",Yes
I18N_GOAL_ENTRIES_TOOLTIP,I18NCode for Goal Entries Tooltip,Number of expected new members in the period for all the context,Paredzamo jauno dalībnieku skaits šajā periodā visā kontekstā,Yes
I18N_GOAL_EXIT_TOOLTIP,I18NNCode for Goal Exit Tooltip,Number of expected dropouts in the period for all the context,Paredzamo atteikumu skaits periodā visā kontekstā,Yes
I18N_GOAL_OTO_TOOLTIP,I18NCode for Goal oto Tooltip,1-2-1s/member/month,1-2-1s/biedrs/mēnesī,Yes
I18N_GOAL_REFERRALS_TOOLTIP,I18NCode for Goal Referrals Tooltip,Referrals/member/week,Ieteikumi/biedrs/nedēļa,Yes
I18N_GOAL_RENEWALS,I18NCode for Goal Renewals in graphic,Renewals Goal,Atjaunošanas mērķis,Yes
I18N_GOAL_RENOVATION_TOOLTIP,I18NCode for Goal Renovation Tooltip,Total submitted renewals at the end of the period,Kopējais iesniegto atjaunošanas gadījumu skaits perioda beigās,Yes
I18N_GOAL_RETENTIONTOOLTIP,Goal RetentionTooltip,Desired Retention at the end of the period (ex: 70),"Vēlamā saglabāšana perioda beigās (piemēram, 70)",Yes
I18N_GOAL_SIZE_TOOLTIP,I18NCode for Goal Size Tooltip,Expected Average Chapter size at the end of the period,"Vēlamā saglabāšana perioda beigās (piemēram, 70)",Yes
I18N_GOAL_TRACKING,I18NCode for Goal Tracking,Goal Tracking,Mērķu izsekošana,Yes
I18N_GOAL_TYFCB_TOOLTIP,I18NCode for Goal TYFCB Tooltip,Thank You For Closed Business,Paldies par slēgto darījumu,Yes
I18N_GOAL_VISITS_TOOLTIP,I18NCode for Goal Visits Tooltip,Visitors/chapter/week,Apmeklētāji/nodaļa/nedēļa,Yes
I18N_GOALS,,Goals,Mērķi,Yes
I18N_GREATER_THAN_OR_EQUAL_TO_0,I18NCode for Greater Than Or Equal To 0,Greater than or equal to 0,Lielāks par 0 vai vienāds ar to,Yes
I18N_GREATER_THAN_OR_EQUAL_TO_2_FAULTS,I18NCode for Greater than or equal to 2 faults,greater than or equal to 2 faults,lielāks vai vienāds ar 2 defektiem,Yes
I18N_GREEN,I18NCode for Green,Green,Zaļš,Yes
I18N_GREEN_LABEL_INFO,I18NCode for Green Label Info,new members that reached Green,"jauni dalībnieki, kas sasniedza Grīnu",Yes
I18N_GRN,I18NCode for #Grn on table label,#Grn,#Grn,Yes
I18N_GROUP,I18NCode for Group,Group,Grupa,Yes
I18N_GROUP_CHAT,I18NCode for Group Chat,Group chat,Grupas tērzēšana,Yes
I18N_GROUP_CHATS_ONLY,"I18NCode for Group chats only
",Group chats only,Tikai grupu tērzēšana,Yes
I18N_GROUP_MECHANISMS,I18NCode for Group Mechanisms Page,Chapter Mechanisms,Nodaļa Mehānismi,Yes
I18N_GROUP_MEMBERS,I18NCode for Group Members,Group members,Grupas dalībnieki,Yes
I18N_GROUPS,,Chapters,nodaļas,Yes
I18N_GROW,I18NCode for Grow.,Grow.,Augt.,Yes
I18N_GROWTH,I18NCode for Growth,Growth,Izaugsme,Yes
I18N_GROWTH_TRACKING_MECHANISMS,I18NCode for Growth Tracking Mechanisms,Growth Tracking Mechanisms,Izaugsmes izsekošanas mehānismi,Yes
I18N_GRY,I18NCode for #Gry on table label,#Gry,#Gry,Yes
I18N_HAS_DEFINED_GOALS,"I18Ncode for Has defined goals
",with defined goals,ar noteiktiem mērķiem,Yes
I18N_HAS_FINANCIAL_DATA,I18NCode for Has Financial Data,Has Financial Data,Ir finanšu dati,Yes
I18N_HAS_GOAL,I18NCode for Has Goal,Has Goal,Ir mērķis,Yes
I18N_HAVE_YOU_ALREADY_RESET_THE_PASSWORD,I18NCode for Have You Already Reset The Password,Have you already reset the password?,Vai esat jau atiestatījis paroli?,Yes
I18N_HELP,I18NCode for Help,Help,Palīdzība,Yes
I18N_HELP_RESIZE_IMAGE_MODAL,"I18NCode for Drag to position, use the corners to resize the cropping area.
","Drag to position, use the corners to resize the cropping area.","Velciet uz pozīciju, izmantojiet stūrus, lai mainītu apgriešanas apgabala izmēru.",Yes
I18N_HIDE_FROM_REPORT,I18NCode for Hide From Report,Hide From Report,Paslēpt no ziņojuma,Yes
I18N_HOST_TEAM,I18NCode for Host Team,Host Team,Uzņēmēja komanda,Yes
I18N_HOW,I18NCode for How,How,Kā,Yes
I18N_HOW_CAN_I_SETUP_TASKS_IN_REPORTING2YOU_AND_AUTOMATE_ZERO_TO_ONE_TASK,I18NCode for How can I setup Tasks in Reporting2You and automate Zero-To-One Task,How can I setup Tasks in Reporting2You and automate Zero-To-One Task,Kā es varu iestatīt uzdevumus programmā Reporting2You un automatizēt nulles pret vienu uzdevumu,Yes
I18N_HOW_DO_I,I18NCode for How do i,How do i...,Kā es varu iestatīt uzdevumus programmā Reporting2You un automatizēt nulles pret vienu uzdevumu,Yes
I18N_HOW_DO_WE_PROTECT_YOUR_INFORMATION,I18NCode for How do we protect your information,How do we protect your information?,Kā mēs aizsargājam jūsu informāciju?,Yes
I18N_HOW_LONG_WILL_YOUR_INFORMATION_BE_HELD,I18NCode for How long will your information be held,How long will your information be held?,Cik ilgi jūsu informācija tiks glabāta?,Yes
I18N_HOW_THIS_INFORMATION_IS_USED,I18NCode for How this information is used,How this information is used?,Kā šī informācija tiek izmantota?,Yes
I18N_HOW_TO_IMPROVE,I18NCode for How to Improve,How do i improve,Kā man uzlabot,Yes
I18N_I_M_NEW_IN_REPORTING2YOU__IS_THERE_ANY_QUICK_OVERVIEW,I18NCode for I'm new in Reporting2You! Is there any quick overview,I'm new in Reporting2You! Is there any quick overview,Esmu jauns pakalpojumā Reporting2You!,Yes
I18N_I18N_DESCRIPTION_IS_VERY_USEFUL,I18NCode for I18n Description is very Useful,Description is very useful,Apraksts ir ļoti noderīgs,Yes
I18N_I18N_WITH_HISTORY_,I18NCode for With History ,History,Vēsture,Yes
I18N_I18N_ZEROREF_W,I18NCode for ZeroREF/week,ZeroREF/W,ZeroREF/W,Yes
I18N_I18NCODES,I18NCodes for I18NCodes,I18N Codes,I18N kodi,Yes
I18N_ICON,I18NCode for Icon,Icon,Ikona,Yes
I18N_IGNORED,I18NCode to Ignored,Ignored,Ignorēts,Yes
I18N_IMAGE_GAME,I18NCode for Image Game,Image Game,Attēlu spēle,Yes
I18N_IMAGE_UPLOAD_ERROR,I18NCode for Image Upload Error,Error submitting image.,"Iesniedzot attēlu, radās kļūda.",Yes
I18N_IMAGE_UPLOAD_SUCCESS,I18NCode for Image Upload Success,Image submitted successfully.,Attēls ir veiksmīgi iesniegts.,Yes
I18N_IMPERSONATION_MODE,I18NCode for Impersonation Mode,Impersonation Mode,Uzdošanās režīms,Yes
I18N_IMPLEMENT_A_BNI_GAME,I18NCode for Implement a BNI Game,Implement a BNI Game,Īstenojiet BNI spēli,Yes
I18N_IMPLEMENT_GAME_NOTE,I18NCode for Implement Game Note,"Note:To configure this report to be sent to members, or Directors you need to go to Regional Administration -> Regional Settings and at the Reports section set who do you want to receive the BNI Game report.<br/>
After this, a report will be generated every Monday for each active BNI Game in your region.","Piezīme. Lai konfigurētu šo pārskatu tā, lai tas tiktu nosūtīts dalībniekiem vai direktoriem, atveriet sadaļu Reģionālā administrācija -> Reģionālie iestatījumi un sadaļā Pārskati iestatiet, kam vēlaties saņemt BNI spēles pārskatu.<br/>",Yes
I18N_IMPORT_TRANSLATIONS,I18NCode for Import Translations,Import Translations,Importēt tulkojumus,Yes
I18N_IMPROVE,I18NCode for Improve,To improve,Lai uzlabotu,Yes
I18N_IN,I18NCode for In,In,In,Yes
I18N_IN_THE_LAST,I18NCode for In the Last,In the last,Pēdējā,Yes
I18N_IN_THE_LASTS,I18NCode for In the Last,In the last,Pēdējā,Yes
I18N_IN_THIS_DATE_RANGE_,"I18NCode for in this date range.
",in this date range.,šajā datumu diapazonā.,Yes
I18N_INACTIVE,I18NCode for Inactive,Inactive,Neaktīvs,Yes
I18N_INACTIVITY_NOTICE,"I18NCode for Inactivity Notice
",Inactivity notice,Paziņojums par neaktivitāti,Yes
I18N_INCOMPLETE_DOWNLOAD,"I18NCode for Incomplete download
",Incomplete download,Nepilnīga lejupielāde,Yes
I18N_INDICATORS,I18NCode for Indicators,Indicators,Rādītāji,Yes
I18N_INDUSTRY,I18NCode for Industry,Industry,Rūpniecība,Yes
I18N_INITIAL_COUNT,I18NCode for Initial Count,Initial Count,Sākotnējais skaits,Yes
I18N_INITIATE_A_POLL,i18NCode for Initiate a Poll,Initiate a poll,Sāciet aptauju,Yes
I18N_INSERT_CODE,I18NCode for I18N name placeholder on modals	,Fill Code with I18N,Aizpildiet kodu ar I18N,Yes
I18N_INSERT_CONTEXT,I18NCode for Context name placeholder on modals	,Enter a name for the new module type,Ievadiet jaunā moduļa veida nosaukumu,Yes
I18N_INSERT_CONTEXT_DESCRIPTION,I18NCode for description placeholder modals	,Fill in the name of the new context,Ievadiet jaunā moduļa veida nosaukumu,Yes
I18N_INSERT_DESCRIPTION,I18NCode for I18N description placeholder on modals	, Fill with the I18NCode description,Ievadiet jaunā konteksta nosaukumu,Yes
I18N_INSERT_DROP_FILES_TASK,I18NCode for the dropzone in task's modal,Drop the files here,Nometiet failus šeit,Yes
I18N_INSERT_LANGUAGE_DESCRIPTION,I18NCode for language description placeholder modals	,Fill in the description of the new language,Aizpildiet jaunās valodas aprakstu,Yes
I18N_INSERT_LANGUAGE_NAME,I18NCode for language name placeholder modals	,Fill in the language  of the new language,Aizpildiet jaunās valodas valodu,Yes
I18N_INSERT_LANGUAGE_SHORTNAME,I18NCode for shortname placeholder modals	,Fill in the shortname of the new language,,Yes
I18N_INSERT_MECHANISMS,I18NCode for Insert Mechanisms,Insert Mechanisms,Ievietošanas mehānismi,Yes
I18N_INSERT_MODULE,I18NCode for module name placeholder on modals, Fill in the name of the new module,Ievadiet jaunā moduļa nosaukumu,Yes
I18N_INSERT_MODULE_DESCRIPTION,I18NCode for description placeholder modals,Enter a name for the new module type,Ievadiet jaunā moduļa veida nosaukumu,Yes
I18N_INSERT_PROFILE_DESCRIPTION,I18NCode for Insert Profile Description,Insert Profile Description,Ievietojiet profila aprakstu,Yes
I18N_INSERT_PROFILE_NAME,I18NCode for Insert Profile Name,Insert Profile Name,Ievietojiet profila nosaukumu,Yes
I18N_INSERT_TASK_DESCRIPTION,I18NCode for insert description in task's modal,Enter a Description,Ievadiet aprakstu,Yes
I18N_INSERT_TRANSLATION_DESCRIPTION,I18NCode for translation description placeholder modals,Fill with the language description,Aizpildiet valodas aprakstu,Yes
I18N_INTERNAL,I18NCode for Internal,Internal,Iekšējā,Yes
I18N_INVALID_CREDENTIALS,I18NCode for Invalid Credentials,Invalid credentials,Nederīgi akreditācijas dati,Yes
I18N_INVALID_OR_EXPIRED_TOKEN,I18NCode for Invalid Or Expired Token,Invalid or Expired token,Nederīga vai beidzies pilnvara,Yes
I18N_INVALID_TOKEN_,I18NCode for Invalid Token, <strong>Invalid Token!</strong> The token provided is invalid.,<strong>Nederīga pilnvara!</strong> Norādītā pilnvara nav derīga.,Yes
I18N_INVALID_USER_DATA,I18NCode for Invalid User Data,Invalid user data,Nederīgi lietotāja dati,Yes
I18N_IS_REPORTING2YOU_GDPR_COMPLIANT,I18NCode for Is Reporting2You GDPR Compliant,Is Reporting2you GDPR compliant,Vai Reporting2you atbilst GDPR,Yes
I18N_IT_WAS_NOT_POSSIBLE_TO_LOAD_THE_MEMBERS,I18NCode for It was not possible to load the members,It was not possible to load the members,Biedrus ielādēt nebija iespējams,Yes
I18N_JANUARY,I18NCode for January,January,janvārī,Yes
I18N_JOIN_DATE,"I18NCode for Join Date
",Join Date,Pievienošanās datums,Yes
I18N_JULY,I18NCode for July,July,jūlijā,Yes
I18N_JUNE,I18NCode for June,June,jūnijā,Yes
I18N_KEY_METRICS,I18NCode for Key metrics,Key metrics,Galvenie rādītāji,Yes
I18N_KINDLY_SUGGEST_THAT,I18NCode for Kindly suggest that,Kindly suggest that,"Lūdzu, iesakiet to",Yes
I18N_KPI,I18NCode for KPI's,Kpi's,Kpi's,Yes
I18N_KPI_CORRELATION,I18NCode for KPI Correlation,Kpi Correlation,Kpi korelācija,Yes
I18N_KPI_EVOLUTION,I18NCode for Kpi Evolution,KPI Evolution,KPI Evolution,Yes
I18N_KPI_GAME,I18NCode for Kpi Game,Kpi Game,Kpi spēle,Yes
I18N_KPI_GAME_BNI,I18NCode for KPI Game BNI,KPI Game KPIS,KPI spēle KPIS,Yes
I18N_KPI_SINGULAR,I18NCode for Kpi in singular,Kpi,Kpi,Yes
I18N_L,I18NCode for L,L,L,Yes
I18N_LANGUAGE,I18NCode for the language name 	,Language,Valoda,Yes
I18N_LANGUAGE_DESCRIPTION,I18NCode for language description,Description,Apraksts,Yes
I18N_LANGUAGES,I18NCodes for Languages,Languages,Valodas,Yes
I18N_LAST,I18NCode for Last,Last,Pēdējais,Yes
I18N_LAST_6_MONTHS,I18NCode for Last 6 Months,Last 6 Months,Pēdējie 6 mēneši,Yes
I18N_LAST_CLOSED_MONTH,I18NCode for Last Closed Month,Last Closed Month,Pēdējais slēgtais mēnesis,Yes
I18N_LAST_MEMBERS_IN_TRAFFIC_LIGHTS,I18NCode for Last Members In Traffic Lights,Last Members in Traffic Lights,Pēdējie dalībnieki luksoforos,Yes
I18N_LAST_MONTH,I18CodeN for last month,Last month:,Pagājušajā mēnesī:,Yes
I18N_LAST_NAME,I18NCode for Last Name label,Last Name,Uzvārds,Yes
I18N_LAST_NEW_MEMBER,I18NCode for Last New Member,Last New Member,Pēdējais jaunais dalībnieks,Yes
I18N_LAST_SPONSORSHIP,I18NCode for Last Sponsorship,Last Sponsorship,Pēdējā sponsorēšana,Yes
I18N_LAST_SUBMITED_PALMS,I18NCode for Last submitted PALMS:,Last submitted PALMS,Pēdējās iesniegtās PULKSMAS,Yes
I18N_LAST_UPDATE,I18NCode for Last Update,Last Update,Pēdējās iesniegtās PULKSMAS,Yes
I18N_LAST12MONTS,I18NCode for Last12Months,Last 12 Months ::,Pēdējie 12 mēneši ::,Yes
I18N_LASTMONTH_MENU,I18NCode for Last Month Side Bar Menu,Last Month,Pagājušais mēnesis,Yes
I18N_LATE,I18NCode for Late,Late,Vēlu,Yes
I18N_LATEST_REPORTS_RECEIVED,Latest Reports Received,Latest Reports Received,Saņemti jaunākie ziņojumi,Yes
I18N_LAUNCH,I18NCode for Launch,Launch,Palaist,Yes
I18N_LAUNCH_DATE,I18NCode for Launch Date,Launch Date,Palaišanas datums,Yes
I18N_LEADERSHIP_TEAM,I18NCode for Leadership Team,Leadership Team,Vadības komanda,Yes
I18N_LEADERSHIP_TEAM_TRAFFIC_LIGHTS,"I18NCode for ""Leadership Team (LT) Traffic Lights""",Leadership Team (LT) Traffic Lights,Vadības komanda (LT) luksofori,Yes
I18N_LEAVING,I18NCode for Exiting,Leaving,Aizbraukšana,Yes
I18N_LENGTH_YEARS,I18NCode for Length(Years),Length (Years),Garums (gadi),Yes
I18N_LEVEL,I18NCode for Level,Level,Līmenis,Yes
I18N_LOADING,I18NCode for Loading,Loading...,Notiek ielāde...,Yes
I18N_LOADING_WARNING_MESSAGE,I18NCode for Loading Warning Message,"Attention!!! This procedure may take a considerable amount of time depending on the number of members, chapters and time interval.",Notiek ielāde...,Yes
I18N_LOCATION___DETAILS,I18NCode for Location & Details,Location & details,Atrašanās vieta un informācija,Yes
I18N_LOG_IN_TO_REPORTING2YOU,"I18NCode for Log In to Reporting2You
",Log In to Reporting2You,Atrašanās vieta un informācija,Yes
I18N_LOG_OUT,I18NCode for Log Out,Logout,Atteikties,Yes
I18N_LOGIN_FAILED,I18NCode for Login Failed,Login Failed,Pieteikšanās neizdevās,Yes
I18N_LOGIN_WITH_EMAIL,"I18NCode for Login with email
",Login with email,Piesakieties ar e-pastu,Yes
I18N_LT,I18NCode for LT,LT,LT,Yes
I18N_LT_SUSPEND_MEMBERSHIP,I18NCode for LT Suspend Membership,LT Suspend membership,LT Apturēt dalību,Yes
I18N_LT_SUSPEND_MEMBERSHIP_LABEL,I18NCode for LT Suspend Membership Label,Activate LT membership suspension,Aktivizējiet LT dalības apturēšanu,Yes
I18N_LT_TRAFFIC_LIGHTS_SCORING_METHOD,"I18NCode for ""LT Traffic Lights Scoring Method""",LT Traffic Lights Scoring Method,LT luksoforu vērtēšanas metode,Yes
I18N_M,I18NCode for M,M,M,Yes
I18N_MANAGE,I18NCode for manage.,Manage,Pārvaldīt,Yes
I18N_MANAGE_CHAPTER_GOALS,I18NCode for Manage Chapter Goals,Manage Chapter Goals,Pārvaldīt nodaļas mērķus,Yes
I18N_MANAGE_COUTRY_GOALS,I18NCode for Manage Coutry Goals,Manage Country Goals,Pārvaldiet valsts mērķus,Yes
I18N_MANAGE_DIRECTOR_GOALS,I18NCode for Manage Director Goals,Manage Director Goal,Vadības direktora mērķis,Yes
I18N_MANAGE_MULTIREGION_GOALS,I18NCode for Manage MultiRegion Goals,Manage Multiregion Goals,Pārvaldiet vairāku reģionu mērķus,Yes
I18N_MANAGE_REGION_GOALS,I18NCode for Manage region goals,Manage Region Goals,Pārvaldiet reģiona mērķus,Yes
I18N_MANAGE_TASKS,I18NCode for Manage Tasks Menu,Manage your tasks,Pārvaldiet savus uzdevumus,Yes
I18N_MANAGE_TEAM_GOALS,,Manage Team Goals,Pārvaldiet komandas mērķus,Yes
I18N_MANAGE_YOUR_GOAL,I18NCode to Manage your goal,Manage your Goal!,Pārvaldiet savu mērķi!,Yes
I18N_MARCH,I18NCode for March,March,Pārvaldiet savu mērķi!,Yes
I18N_MARKET,I18NCode for Market,Market,Tirgus,Yes
I18N_MAX,I18NCode represent Max:,Max:,Maks.:,Yes
I18N_MAXIMUM,I18NCode for Maximum,File too large. The maximum size is 5MB.,Fails ir pārāk liels.,Yes
I18N_MAY,I18NCode for May,May,maijā,Yes
I18N_MB,I18NCode for MB,MB,MB,Yes
I18N_MC,I18NCode for MC,MC,MC,Yes
I18N_MCKPI_DESCRIPTION,I18NCode for MCKPI Description,"This is a  <strong>monthly report</strong> that usually is sent to each Leadership Team every 3rd working day of the month.<br/>

It is a fantastic report that has two pages, in the first one you can see the Leadership Team members and the major chapter Key Performance Indicator for 12 and 6 months and at the second page, you will find the previous month Chapter Notable Networkers for Referrals, Business Given, One-to-Ones and Visitors.

It really saves time to LT and, if they print the report, they can use it at the Checkin Table...","Šis ir <strong>ikmēneša pārskats</strong>, kas parasti tiek nosūtīts katrai vadības komandai katru mēneša trešo darba dienu.<br/>",Yes
I18N_MCKPI_MONTHLY_CHAPTER_KEY_PERFORMANCE_INDICATORS_REPORT,I18NCode for MCKPI - Monthly Chapter Key Performance Indicators Report,MCKPI - Monthly Chapter Key Performance Indicators Report,MCKPI — ikmēneša nodaļas galveno veiktspējas rādītāju pārskats,Yes
I18N_MCMTE_DESCRIPTION,I18NCode for MCMTE Description,"This is a <strong>monthly report</strong> that usually is sent to LT's and DC's (the ED must set who receives it, LT, DC...) every 3rd working day of the month.<br/>

The goal is to give LT's and Directors an update regarding their members performance evolution and also the ability to understand Mentors success.","Šis ir <strong>ikmēneša pārskats</strong>, kas parasti tiek nosūtīts LT un DC (ED ir jāiestata, kurš to saņem, LT, DC...) katru mēneša 3. darba dienu.<br/>",Yes
I18N_MCMTE_MONTHLY_MEMBER_TRAFFIC_LIGHTS_EVOLUTION_,I18NCode for MCMTE Monthly Member Traffic Lights Evolution ,MCMTE - Monthly Member Traffic Lights Evolution,MCMTE — ikmēneša dalībnieku luksoforu attīstība,Yes
I18N_MCMTL__MONTHLY_MEMBER_TRAFFIC_LIGHTS_REPORT,I18NCode for MCMTL - Monthly Member Traffic Lights Report,MCMTL - Monthly Member Traffic Lights Report,MCMTL — ikmēneša dalībnieku luksoforu pārskats,Yes
I18N_MCMTL_DESCRIPTION,I18NCode for MCMTL Description,"This is a <strong>monthly report</strong> that usually is sent each member (the ED decides who receives it, LT, DC...) every 3rd working day of the month.<br/>

The goal is to give each member enough information to understand where he needs to invest time in order to work is own VCP. If he opens the file with Adobe Acrobat Reader he can click his name and the system will tell him how many referrals, trainings, one-to-one, visitors, testimonials he needs to do to reach next color and Green... try it! It is really great.","Šis ir <strong>ikmēneša pārskats</strong>, kas parasti tiek nosūtīts katram dalībniekam (ED izlemj, kurš to saņem, LT, DC...) katru mēneša 3. darba dienu.<br/>",Yes
I18N_MCP_DESCRIPTION,I18NCode for Description,"This is a <strong>monthly report</strong> that usually is sent to the Leadership Team every 3rd working day of the month.<br/>

The goal is to give each Leadership and DC a tool to look for the principal Key Success Factor to fix (Power of One), because in this report it is so easy to understand the chapter evolution on each and every KSF and other KPI's","Šis ir <strong>ikmēneša pārskats</strong>, kas parasti tiek nosūtīts vadības komandai katru mēneša trešo darba dienu.<br/>",Yes
I18N_MCP_MONTHLY_CHAPTER_PERFORMANCE_REPORT,I18NCode for MCP Monthly Chapter Performance Report,MCP - Monthly Chapter Performance Report,MCP — ikmēneša nodaļas darbības pārskats,Yes
I18N_MDAA_DESCRIPTION,I18NCode for MDAA Description,"This is a <strong>monthly report</strong> that usually is sent to each AD every 3rd working day of the month.

The goal is to give, in only one report, the list of next 3 month renewals and identify on that list the members in member traffic lights RED or GRAY, and also complete list of what happened last month in the region (late, dropped , new and renewed members, members with 3 or more absences, members with 3 or more substitutions, PALMS monitoring and Directors Chapter Visits)","Šis ir <strong>ikmēneša pārskats</strong>, kas parasti tiek nosūtīts katrai AD katrai mēneša 3. darba dienai.",Yes
